TITLE,YEAR,DOI,LANG,JOURNAL,QUALIS,ISSN,AUTHOR,ORDER,ORDER_OK,JCR
Using digital photogrammetry to conduct an anthropometric analysis of wheelchair users,2012,10.3233/WOR-2012-0070-4053,Inglês,"Work (Reading, MA)",XX,1051-9815,"['Helda Oliveira Barros', 'Marcelo Márcio Soares']","['1', '2']",['1'],-99
Anthropometric analysis of wheelchair users: methodological factors which influencei nterpopulational comparison,2012,10.3233/WOR-2012-0702-4091,Inglês,"Work (Reading, MA)",XX,1051-9815,"['Helda Oliveira Barros', 'Marcelo Márcio Soares']","['1', '2']",['1'],-99
O Programa de Pós-graduação em Design da CESAR School: Perspectivas e Vivências no Porto Digital do Recife,2022,10.29147/datjournal.v7i2.617,Português,DATJOURNAL DESIGN ART AND TECHNOLOGY,XX,2526-1789,"['Helda Oliveira Barros', 'Arcoverde Junior, José Carlos Porto']","['1', '2']",['1'],-99
Desenhando conversas com personalidade: aplicação do processo de design para desenvolvimento de framework de design conversacional,2022,10.29147/datjournal.v7i2.616,Português,DATJOURNAL DESIGN ART AND TECHNOLOGY,XX,2526-1789,"['Willian Das Neves Grillo', 'Helda Oliveira Barros']","['1', '2']",['2'],-99
"Virtualização e Fisioterapia: desenvolvimento, avaliação da performance e heurísticas de usabilidade em dois sistemas de realidade virtual e realidade mista para reabilitação de membros superiores",2022,10.29147/datjournal.v7i2.615,Português,DATJOURNAL DESIGN ART AND TECHNOLOGY,XX,2526-1789,"['André Felipe da Silva Figueiredo', 'Helda Oliveira Barros']","['1', '2']",['2'],-99
"O Design como Ferramenta de Auxílio no Acolhimento de Estudantes com Necessidades Educacionais Especiais, na Perspectiva do Corpo Técnico Administrativo de uma IES",2022,10.29147/datjournal.v7i2.619,Português,DATJOURNAL DESIGN ART AND TECHNOLOGY,XX,2526-1789,"['NATALIA AQUINO', 'Helda Oliveira Barros']","['1', '2']",['2'],-99
Ações estratégicas cocriadas sob métodos de Design para o ecossistema do Porto Digital,2022,10.29147/datjournal.v7i2.622,Português,DATJOURNAL DESIGN ART AND TECHNOLOGY,XX,2526-1789,"['Maria Chaves Pessoa Monteiro', 'Helda Oliveira Barros']","['1', '2']",['2'],-99
