COURSE,YEAR,INTEGRANTES
Mídia e Educação a Distância- Disciplina Ministrada no curso de formação de Tutores para as licenciaturas a Distância (Modalidade EaD),2005,"['Walquíria Castelo Branco Lins', 'Marcus Galindo']"
Importância da Reflexão Filosófica na Construção do Projeto Pedagógico do Colégio Boa Viagem,1997,['Walquíria Castelo Branco Lins']
Multimídias e Educação,2006,['Walquíria Castelo Branco Lins']
Adaptação do Ensino de História para o 1o graua,1995,['Walquíria Castelo Branco Lins']
Trabalhando com representações gráficas nas séries iniciais do Ensino Fundamental,2002,"['Walquíria Castelo Branco Lins', 'Verônica Gitirana']"
Informática na Educação,2002,"['Walquíria Castelo Branco Lins', 'Verônica Gitirana']"
Informática na Educação Matemática,2006,"['Walquíria Castelo Branco Lins', 'Verônica Gitirana']"
