NATUREZA,TITULO,ANO,PAIS,IDIOMA,NOME-DO-CANDIDATO,CODIGO_INSTITUICAO,NOME-DA-INSTITUICAO,NOME-ORGAO,NOME-DO-CURSO,NOME-PARTICIPANTE-BANCA,ORDEM-PARTICIPANTE,NOME-CITACAO-BANCA,NRO-ID-CNPQ
Mestrado,Educação Ambiental e Formação Continuada de Professores: (re)interpretações das questões ambientais através das TIC,2013,Brasil,Português,VAZIO,,,VAZIO,,Washington Luiz Pacheco de Carvalho;Edênia Maria Ribeiro do Amaral;Marcelo Brito Carneiro Leão;Walquíria Castelo Branco Lins;,1;2;3;4;,"CARVALHO, W. L. P.;AMARAL, E. M. R.;CARNEIRO LEÃO, M.B.;LINS, Walquíria C.B.;",
Mestrado,A Lousa Digital no Ensino de Razões e Proporções: uma análise das interações,2013,Brasil,Português,VAZIO,002100000009,Universidade Federal de Pernambuco,VAZIO,Educação Matemática e Tecnológica,Verônica Gitirana;Sérgio Paulino Abranches;Tânia Maria Mendonça Campos;Walquíria Castelo Branco Lins;,1;2;3;4;,"GITIRANA, Verônica;ABRANCHES, Sérgio Paulino;CAMPOS, T.M.M.;LINS, Walquíria C.B.;",
Mestrado,O Processo de Construção da FlexQuest por Professores de Ciências: análise de alguns saberes necessários,2013,Brasil,Português,VAZIO,033800000001,Universidade Federal Rural de Pernambuco,VAZIO,Ensino das Ciências,Marcelo Brito Carneiro Leão;Walquíria Castelo Branco Lins;Ângela Fernandes Campos;Mônica Maria Lins Santiago;,1;2;3;4;,"CARNEIRO LEÃO, M.B.;LINS, Walquíria C.B.;CAMPOS, A. F.;SANTIAGO, M. M. L.;",
Mestrado,A Utilização das Tecnologias da Informação e Comunicação (TICs) em Cursos de Licenciatura em Química,2014,Brasil,Português,VAZIO,033800000001,Universidade Federal Rural de Pernambuco,VAZIO,Ensino das Ciências,Marcelo Brito Carneiro Leão;Patrícia Smith Cavalcante;Edênia Maria Ribeiro do Amaral;Walquíria Castelo Branco Lins;,1;2;3;4;,"CARNEIRO LEÃO, M.B.;CAVALCANTE, Patrícia Smith;AMARAL, E. M. R.;LINS, Walquíria C.B.;",
Mestrado,"Educação Ambiental, Formação de Professores e TIC: (RE)INTERPRETAÇÕES DESDE UMA EXPERIÊNCIAS FORMATIVA",2014,Brasil,Português,VAZIO,033800000001,Universidade Federal Rural de Pernambuco,VAZIO,Ensino das Ciências,Carmen ROselaine de Oliveira FARIAS;Washington Luiz Pacheco de Carvalho;Edênia Maria Ribeiro do Amaral;Walquíria Castelo Branco Lins;Marcelo Brito Carneiro Leão;Claudia Roberta de Araújo Gomes;,1;2;3;4;5;6;,"FARIAS, C. R. O.;CARVALHO, W. L. P.;AMARAL, E. M. R.;CASTELO BRANCO, W.;CARNEIRO LEÃO, M.B.;GOMES, C. R. A.;",
Mestrado,"Adaptação do Scrum aderente ao nível G do MPS.BR baseada na experiência dos implementadores, avaliadores e empresas avaliadas",2014,Brasil,Português,VAZIO,091400000001,Centro de Estudos e Sistemas Avançados do Recife,VAZIO,Mestrado Profissional em Engenharia de Software,Felipe Santana Furtado Soares;Ivaldir Honório de Farias Júnior;Walquíria Castelo Branco Lins;Marcely Daniela Silva dos Santos;,1;2;3;4;,"SOARES, F. S. F.;FARIAS JUNIOR, I. H.;CASTELO BRANCO, W.;SANTOS, M. D. S.;",
Mestrado,Saberes Docentes e Formação Continuada: concepções de docentes formadores atuantes em cursos na modalidade a distância,2014,Brasil,Português,VAZIO,002100000009,Universidade Federal de Pernambuco,VAZIO,Educação Matemática e Tecnológica,Sérgio Paulino Abranches;Walquíria Castelo Branco Lins;Maria Auxiliadora Soares Padilha;,1;2;3;,"ABRANCHES, Sérgio Paulino;LINS, Walquíria C.B.;PADILHA, M. A. S.;",
Mestrado,Fermata Astuta - Uma proposta de acessibilidade para analfabetos em um sistema de para de ônibus para ajudar na construção de cidades inteligentes,2014,Brasil,Português,VAZIO,091400000001,Centro de Estudos e Sistemas Avançados do Recife,VAZIO,Mestrado Profissional em Engenharia de Software,Walquíria Castelo Branco Lins;Alberto César França;Elisa Sattyam de Farias Cardozo;,1;2;3;,"LINS, Walquíria C.B.;FRANCA, A. C.;CARDOZO, E. S. F.;",
Mestrado,Relato da Melhoria do Planejamento e Estimativas em Projetos de Desenvolvimento de Software: um estudo de caso,2014,Brasil,Português,VAZIO,091400000001,Centro de Estudos e Sistemas Avançados do Recife,VAZIO,Mestrado Profissional em Engenharia de Software,Allan Rodrigo dos Santos Araújo;José Carreira Álvares Neto;Maria Carolina Torres da Silva;Walquíria Castelo Branco Lins;,1;2;3;4;,"ARAUJO, A. R. S.;ALVARES NETO, J. C.;SILVA, M. C. T.;LINS, Walquíria C.B.;",
Mestrado,SuSCITE: Simulation Smart City TestBed - Um ambiente para validação de aplicações voltadas para ambientes urbanos baseado em Serviços,2014,Brasil,Português,VAZIO,091400000001,Centro de Estudos e Sistemas Avançados do Recife,VAZIO,Mestrado Profissional em Engenharia de Software,Felipe Silva Ferraz;Walquíria Castelo Branco Lins;Filipe Carlos de Albuquerque Calegario;,1;2;3;,"FERRAZ, F. S.;LINS, Walquíria C.B.;CALEGARIO, F. C. A.;",
Mestrado,Smart Path: uma análise exploratória do tempo gasto em trajetos urbanos com auxílio de aplicativo mobile de coleta colaborativa,2014,Brasil,Português,VAZIO,091400000001,Centro de Estudos e Sistemas Avançados do Recife,VAZIO,Mestrado Profissional em Engenharia de Software,Felipe Silva Ferraz;Walquíria Castelo Branco Lins;Filipe Carlos de Albuquerque Calegario;,1;2;3;,"FERRAZ, F. S.;LINS, Walquíria C.B.;CALEGARIO, F. C. A.;",
Mestrado,Soluções em Big Data para Ambientes Urbanos: uma revisão sistemática,2014,Brasil,Português,VAZIO,091400000001,Centro de Estudos e Sistemas Avançados do Recife,VAZIO,Mestrado Profissional em Engenharia de Software,Felipe Silva Ferraz;Walquíria Castelo Branco Lins;Maria Carolina Torres da Silva;,1;2;3;,"FERRAZ, F. S.;LINS, Walquíria C.B.;SILVA, M. C. T.;",
Mestrado,Uso de SOA na Modernização de Softwares Legados: uma revisão sistemática da Literatura,2014,Brasil,Português,VAZIO,091400000001,Centro de Estudos e Sistemas Avançados do Recife,VAZIO,Mestrado Profissional em Engenharia de Software,Walquíria Castelo Branco Lins;Eric Bruno Perazzo Mariz;Alberto César França;Francieric Alves de Araújo;,1;2;3;4;,"LINS, Walquíria C.B.;MARIZ, E. B. P.;FRANCA, A. C.;ARAUJO, F. A.;",
Mestrado,Comparativo no uso de Técnicas Clássicas e Técnicas de Design na Concepção do Produto para Elaboração de Jogos Digitais Educativos,2011,Brasil,Português,VAZIO,091400000001,Centro de Estudos e Sistemas Avançados do Recife,VAZIO,Mestrado Profissional em Engenharia de Software,Walquíria Castelo Branco Lins;Fábio Ferreira da Costa Campos;Verônica Gitirana;,1;2;3;,"LINS, Walquíria C.B.;CAMPOS, F. F. C.;GITIRANA, Verônica;",4727708481050412;
Mestrado,Apropriação Tecnológica de Estudantes no Programa Aluno Conectado,2015,Brasil,Português,VAZIO,002100000009,Universidade Federal de Pernambuco,VAZIO,Educação Matemática e Tecnológica,Ana Beatriz Gomes Pimenta de Carvalho;Patrícia Smith Cavalcante;Walquíria Castelo Branco Lins;,1;2;3;,"CARVALHO, A. B. G. P.;CAVALCANTE, Patrícia Smith;LINS, Walquíria C.B.;",
Mestrado,Uma Ferramenta de Apoio ao Teste baseado em Estados para Aplicações Java Utilizando Aspectos,2015,Brasil,Português,VAZIO,091400000001,Centro de Estudos e Sistemas Avançados do Recife,VAZIO,Mestrado Profissional em Engenharia de Software,Gustavo Henrique da Silva Alexandre;Walquíria Castelo Branco Lins;José Carreira Álvares Neto;Mônique Conceição Soares;,1;2;3;4;,"ALEXANDRE, G.H.S.;LINS, Walquíria C.B.;ALVARES NETO, J. C.;SOARES, M.C.;",
Mestrado,Framework baseado em Ontologia para Jogos de Realidade,2015,Brasil,Português,VAZIO,091400000001,Centro de Estudos e Sistemas Avançados do Recife,VAZIO,Mestrado Profissional em Engenharia de Software,Alberto César França;Marco Túlio Caraciolo Ferreira Alburquerque;Walquíria Castelo Branco Lins;,1;2;3;,"FRANCA, A. C.;ALBURQUERQUE, M.T.C.F.;LINS, Walquíria C.B.;",
Mestrado,PIMP: Um modelo de processo para implantação da melhoria de processos de software,2015,Brasil,Português,VAZIO,091400000001,Centro de Estudos e Sistemas Avançados do Recife,VAZIO,Mestrado Profissional em Engenharia de Software,Ana Paula Carvalho Cavalcanti Furtado;Ivaldir Farias Honório Júnior;Walquíria Castelo Branco Lins;,1;2;3;,"FURTADO, A.P.C.C.;HONORIO Jr, I.F.;LINS, Walquíria C.B.;",
Mestrado,O Papel das pessoas e dos sensores no desenvolvimento das smart cities:uma revisão sistemática da literatura,2015,Brasil,Português,VAZIO,091400000001,Centro de Estudos e Sistemas Avançados do Recife,VAZIO,Mestrado Profissional em Engenharia de Software,Walquíria Castelo Branco Lins;Felipe Silva Ferraz;Maria Carolina Torres da Silva;,1;2;3;,"LINS, Walquíria C.B.;FERRAZ, F. S.;SILVA, M. C. T.;",
Mestrado,Análise do Educandus sob a ótica da usabilidade,2015,Brasil,Português,VAZIO,091400000001,Centro de Estudos e Sistemas Avançados do Recife,VAZIO,Mestrado Profissional em Engenharia de Software,Walquíria Castelo Branco Lins;Walter Franklin Marques Correia;Ney Brito Dantas;,1;2;3;,"LINS, Walquíria C.B.;CORREIA, W. F. M.;DANTAS, N. B.;",
Mestrado,"RECREARTES, um processo criativo de engenharia de requisitos",2015,Brasil,Português,VAZIO,091400000001,Centro de Estudos e Sistemas Avançados do Recife,VAZIO,Mestrado Profissional em Engenharia de Software,Walquíria Castelo Branco Lins;Felipe Silva Ferraz;Leonardo Augusto Gomez Castilho;,1;2;3;,"LINS, Walquíria C.B.;FERRAZ, F. S.;CASTILHO, L. A. G.;",
Mestrado,Jogos Educacionais como Ferramenta de Apoio na Imersão de Profissionais em Teste de Software,2014,Brasil,Português,VAZIO,091400000001,Centro de Estudos e Sistemas Avançados do Recife,VAZIO,Mestrado Profissional em Engenharia de Software,Walquíria Castelo Branco Lins;Gustavo de Souza Alves;Danuza Ribeiro Bezerra da Cunha;,1;2;3;,"LINS, Walquíria C.B.;ALVES, G. S.;CUNHA, D. R. B.;",
Mestrado,Revisão Sistemática em Estudos em Segurança no Ambiente de Cloud Computing,2014,Brasil,Português,VAZIO,091400000001,Centro de Estudos e Sistemas Avançados do Recife,VAZIO,Mestrado Profissional em Engenharia de Software,Walquíria Castelo Branco Lins;Felipe Silva Ferraz;Danilo Ricardo Barbosa de Araújo;,1;2;3;,"LINS, Walquíria C.B.;FERRAZ, F. S.;ARAUJO, D. R. B.;",
Mestrado,OSFISIO: Ferramenta para obtenção de resultados fidedignos ao TC6,2014,Brasil,Português,VAZIO,091400000001,Centro de Estudos e Sistemas Avançados do Recife,VAZIO,Mestrado Profissional em Engenharia de Software,Walquíria Castelo Branco Lins;Alberto César França;Vitor Caiaffo Brito;,1;2;3;,"LINS, Walquíria C.B.;FRANCA, A. C.;BRITO, V. C.;",
Mestrado,Levantamento de Requisitos Necessários para Aprendizagem de Programação em Ambientes de Aprendizagem Colaborativos a Distância,2015,Brasil,Português,VAZIO,091400000001,Centro de Estudos e Sistemas Avançados do Recife,VAZIO,Mestrado Profissional em Engenharia de Software,Felipe Santana Furtado Soares;Walquíria Castelo Branco Lins;Verônica Gitirana;,1;2;3;,"SOARES, F. S. F.;LINS, Walquíria C.B.;GITIRANA, Verônica;",4727708481050412;
Mestrado,LabDuino: Uma plataforma embarcada para ensino de ciências,2015,Brasil,Português,VAZIO,091400000001,Centro de Estudos e Sistemas Avançados do Recife,VAZIO,Mestrado Profissional em Engenharia de Software,Felipe Silva Ferraz;Walquíria Castelo Branco Lins;Verônica Gitirana;,1;2;3;,"FERRAZ, F. S.;LINS, Walquíria C.B.;GITIRANA, Verônica;",4727708481050412;
Mestrado,Soluções Mobile para Problemas de Trânsito Urbano: um mapeamento sistemático da literatura,2015,Brasil,Português,VAZIO,091400000001,Centro de Estudos e Sistemas Avançados do Recife,VAZIO,Mestrado Profissional em Engenharia de Software,Felipe Silva Ferraz;Walquíria Castelo Branco Lins;Maria Carolina Torres da Silva;,1;2;3;,"FERRAZ, F. S.;LINS, Walquíria C.B.;SILVA, M. C. T.;",
Mestrado,GestorBOX: ambiente virtual de aprendizagem gamificado aplicado ao ensino de empreendedorismo,2015,Brasil,Português,VAZIO,091400000001,Centro de Estudos e Sistemas Avançados do Recife,VAZIO,Mestrado Profissional em Engenharia de Software,Walquíria Castelo Branco Lins;Marcus Vinícius Dantas Linhares;Gustavo Henrique da Silva Alexandre;Genésio Gomes da Cruz Neto;,1;2;3;4;,"LINS, Walquíria C.B.;LINHARES, M. V. D.;ALEXANDRE, G.H.S.;CRUZ NETO, G. G.;",
Mestrado,Levantamento de Requisítos Necessários para a Aprendizagem de Programação em Ambientes de Aprendizagem Colaborativo a Distância,2015,Brasil,Português,VAZIO,091400000001,Centro de Estudos e Sistemas Avançados do Recife,VAZIO,Mestrado Profissional em Engenharia de Software,Walquíria Castelo Branco Lins;Felipe Santana Furtado Soares;Veronica Gitirana Gomes Ferreira;,1;2;3;,"LINS, Walquíria C.B.;SOARES, F. S. F.;GITIRANA GOMES-FERREIRA, V.;",4727708481050412;
Mestrado,Crowd Literature Review - um ferramenta para apoiar o processo de revisão sistemática da literatura de forma colaborativa,2016,Brasil,Português,VAZIO,002100000009,Universidade Federal de Pernambuco,VAZIO,Educação Matemática e Tecnológica,Walquíria Castelo Branco Lins;Gustavo Henrique da Silva Alexandre;Danilo Monteiro Ribeiro;,1;2;3;,"LINS, Walquíria C.B.;ALEXANDRE, G.H.S.;RIBEIRO, D. M.;",
Mestrado,Virtualização de Serviços em Teste de SOftware: uma revisão sistemática,2016,Brasil,Português,VAZIO,091400000001,Centro de Estudos e Sistemas Avançados do Recife,VAZIO,Mestrado Profissional em Engenharia de Software,Gustavo de Souza Alves;Danusa Ribeiro Bezerra da Cunha;Walquíria Castelo Branco Lins;,1;2;3;,"ALVES, G. S.;CUNHA, D. R. B.;LINS, Walquíria C.B.;",
Mestrado,Design participativo aplicado à concepção de intervenções urbanas lúdicas. um estudo de caso do projeto playtown,2017,Brasil,Português,VAZIO,091400000001,Centro de Estudos e Sistemas Avançados do Recife,VAZIO,Mestrado Profissional Design de Artefatos Digitais,Gustavo Henrique da Silva Alexandre;Tarciana Araujo Brito de Andrade;Walquíria Castelo Branco Lins;,1;2;3;,"ALEXANDRE, G.H.S.;ANDRADE, T. A. B.;LINS, Walquíria C.B.;",
Mestrado,A contribuição do design na experiência de Espera dos Pretendentes a pais no processo de adoção no Recife,2017,Brasil,Português,VAZIO,091400000001,Centro de Estudos e Sistemas Avançados do Recife,VAZIO,Mestrado Profissional Design de Artefatos Digitais,Walquíria Castelo Branco Lins;Virginia Carvalho Chalegre;Eliana Virgínia Vieira de Melo;,1;2;3;,"LINS, Walquíria C.B.;CHALEGRE, V. C.;MELO, E. V. V.;",
Mestrado,Um Framework para a Comunicação do Projeto Político Pedagógico de Escolas Inovadoras: as contribuições do Design de Serviço,2017,Brasil,Português,VAZIO,091400000001,Centro de Estudos e Sistemas Avançados do Recife,VAZIO,Mestrado Profissional em Design,Walquíria Castelo Branco Lins;André Menezes Marques das Neves;Patrícia Smith Cavalcante;,1;2;3;,"LINS, Walquíria C.B.;NEVES, A. M. M.;CAVALCANTE, Patrícia Smith;",2517625255352224;
Mestrado,Soluções Mobile para Problemas de Transito Urbano: um mapeamento sistemático da literatura,2017,Brasil,Português,VAZIO,091400000001,Centro de Estudos e Sistemas Avançados do Recife,VAZIO,Mestrado Profissional em Engenharia de Software,Felipe da Silva Ferraz;Maria Carolina Torres da Silva;Walquíria Castelo Branco Lins;,1;2;3;,"FERRAZ, F. S.;SILVA, M. C. T.;LINS, Walquíria C.B.;",
Mestrado,"TesteCHAMES ? Uma plataforma de avaliação do conhecimento, habilidades e atitudes, exigidos pelo mercado brasileiro, na área de engenharia de software",2017,Brasil,Português,VAZIO,091400000001,Centro de Estudos e Sistemas Avançados do Recife,VAZIO,Mestrado Profissional em Engenharia de Software,Walquíria Castelo Branco Lins;Gustavo Henrique da Silva Alexandre;Maria Lencastre Pinheiro de Menezes e Cruz;,1;2;3;,"LINS, WALQUIRIA CASTELO BRANCO;ALEXANDRE, G.H.S.;CRUZ, M. L. P. M. E.;",
Mestrado,Desenvolvimento de uma Ferramenta para Auxiliar na Detecção do Estresse Térmico Bovino,2018,Brasil,Português,VAZIO,091400000001,Centro de Estudos e Sistemas Avançados do Recife,VAZIO,Mestrado Profissional em Engenharia de Software,Melissa Barbosa Pontes;Louis Hélvio Rolin de Britto;Walquíria Castelo Branco Lins;,1;2;3;,"PONTES, M. B.;BRITTO, L. H. R.;LINS, WALQUIRIA CASTELO BRANCO;",
Mestrado,Revisão Sistemática sobre a Relevância dos Padrões de Projeto Gof para o Desenvolvimento de Jogos Digitais Modernos,2018,Brasil,Português,VAZIO,091400000001,Centro de Estudos e Sistemas Avançados do Recife,VAZIO,Mestrado Profissional em Engenharia de Software,Felipe Silveira Mello Borgiani;Ewerton Menezes de Mendonça;Walquíria Castelo Branco Lins;,1;2;3;,"BORGIANI, F. S. M.;MENDONCA, E. M.;LINS, WALQUIRIA;",
Mestrado,Um estudo prático utilizando uma ferramenta IoT como uma proposta para auxiliar na identificação de cólica e análise comportamental equina,2019,Brasil,Português,VAZIO,091400000001,Centro de Estudos e Sistemas Avançados do Recife,VAZIO,Mestrado Profissional em Engenharia de Software,Melissa Barbosa Pontes;Walquíria Castelo Branco Lins;,1;2;,"PONTES, M. B.;LINS, Walquíria C.B.;",
Mestrado,MAyA (Managing your Animal): Gestão de Pet's através de Dispositivos Físicos Integrados a uma Plataforma como Serviço,2019,Brasil,Português,VAZIO,091400000001,Centro de Estudos e Sistemas Avançados do Recife,VAZIO,Mestrado Profissional em Engenharia de Software,Vanilson André de Arruda Burégio;Carlos Julian Menezes Araújo;Walquíria Castelo Branco Lins;,1;2;3;,"BUREGIO, V. A. A.;ARAUJO, C. J. M.;LINS, Walquíria C.B.;",
Mestrado,Aprendizagem Baseada em Projetos no Ensino de Fundamentos de Programação: uma abordagem gamificada,2019,Brasil,Português,VAZIO,091400000001,Centro de Estudos e Sistemas Avançados do Recife,VAZIO,Mestrado Profissional em Engenharia de Software,Walquíria Castelo Branco Lins;Ana Paula Carvalho Cavalcanti Furtado;Maria Auxiliadora Soares Padilha;,1;2;3;,"CASTELO BRANCO, W.;FURTADO, A.P.C.C.;PADILHA, M. A. S.;",
Mestrado,Evasão no Curso de Sistemas de Informação: um estudo aplicado à disciplina de Algoritmos e Programação,2019,Brasil,Português,VAZIO,091400000001,Centro de Estudos e Sistemas Avançados do Recife,VAZIO,Mestrado Profissional em Engenharia de Software,Walquíria Castelo Branco Lins;Gustavo Henrique da Silva Alexandre;Ivoneide Mendes da Silva;,1;2;3;,"LINS, WALQUIRIA;ALEXANDRE, G.H.S.;SILVA, I. M.;",9473628582524810;
Mestrado,Uso de software de programação no ensino fundamental: um estudo de caso da perspectiva da interdisciplinaridade computacional como facilitador do aprendizado,2019,Brasil,Português,VAZIO,091400000001,Centro de Estudos e Sistemas Avançados do Recife,VAZIO,Mestrado Profissional em Engenharia de Software,Walquíria Castelo Branco Lins;Gustavo Henrique da Silva Alexandre;Ivoneide Mendes da Silva;,1;2;3;,"LINS, WALQUIRIA;ALEXANDRE, G.H.S.;SILVA, I. M.;",9473628582524810;
Mestrado,A Contribuição do Design na Transmissão da Informação Sobre Risco Genético para o Câncer de Mama ? A Questão da Percepção de Risco,2022,Brasil,Português,VAZIO,091400000001,Centro de Estudos e Sistemas Avançados do Recife,VAZIO,Design,Marcello Caldas Bressan;Vandré Cabral Gomes Carneiro;Michel Satya Naslavsky;Walquíria Castelo Branco Lins;,1;2;3;4;,"BRESSAN, M. C.;CARNEIRO, V. C. G.;NASLAVSKY, M. S.;LINS, WALQUÍRIA CASTELO BRANCO;",
Mestrado,Contribuição do Design de Serviços na Melhoria da Experiência de Estágio Extracurricular: Uma proposta para o Poder Judiciário Estadual de Pernambuco,2022,Brasil,Português,VAZIO,091400000001,Centro de Estudos e Sistemas Avançados do Recife,VAZIO,Design,Walquíria Castelo Branco Lins;Helda Oliveira Barros;Sílvio de Albuquerque Santos;,1;2;3;,"LINS, WALQUIRIA CASTELO BRANCO;BARROS, H. O.;SANTOS, S. A.;",
Mestrado,Design de Serviço como Metodologia para Melhoria da Experiência do Usuário em uma Construtora,2021,Brasil,Português,VAZIO,091400000001,Centro de Estudos e Sistemas Avançados do Recife,VAZIO,Design,Walquíria Castelo Branco Lins;Marcelo Penha;Carla Link Federizzi;,1;2;3;,"LINS, WALQUIRIA;PENHA, M.;FEDERIZZI, C. L.;",
Mestrado,Design de Serviço Aplicado ao Contexto Educacional: Um Estudo sobre demandas irregulares de serviços educacionais em uma empresa de ensino profissional e tecnológico,2022,Brasil,Português,VAZIO,091400000001,Centro de Estudos e Sistemas Avançados do Recife,VAZIO,Design,Walquíria Castelo Branco Lins;Carlos Henrique Pompéu;Mércia Rodrigues Farias da Silva;,1;2;3;,"LINS, Walquíria C.B.;POMPEU, C. H.;SILVA, M. R. F.;",
Mestrado,Design de Serviço e suas contribuições para o avanço da gestão de voluntários em associações de maconha terapêutica,2022,Brasil,Português,VAZIO,091400000001,Centro de Estudos e Sistemas Avançados do Recife,VAZIO,Mestrado Profissional em Design,Walquíria Castelo Branco Lins;Marcello Caldas Bressan;Turla Ângela Alquete de Arreguy Baptista;,1;2;3;,"LINS, WALQUIRIA CASTELO BRANCO;BRESSAN, M. C.;BAPTISTA, T. A. A. A.;",
Mestrado,O DESIGN DE SERVIÇO E A INCLUSÃO DE PESSOAS COM DEFICIÊNCIA AUDITIVA NO TRIBUNAL DE JUSTIÇA DE PERNAMBUCO: UMAABORDAGEM INCLUSIVA PARA UMA PRESTAÇÃO JURISDICIONAL  MAIS EFETIVA À SOCIEDADE,2021,Brasil,Português,VAZIO,091400000001,Centro de Estudos e Sistemas Avançados do Recife,VAZIO,Mestrado Profissional em Design,Walquíria Castelo Branco Lins;Érika Cavalcanti Madeira Campos;Fabiana Wanderley de Souza Moreira;,1;2;3;,"CASTELO BRANCO, W.;CAMPOS, E. C. M.;MOREIRA, F. W. S.;",
Mestrado,"O Design como Ferramenta de Auxílio no Acolhimento de Estudantes, com Necessidades Educacionais Especiais, na Perspectiva do Corpo Técnico Administrativo de Uma IES",2021,Brasil,Português,VAZIO,091400000001,Centro de Estudos e Sistemas Avançados do Recife,VAZIO,Design,Helda Oliveira Barros;Walquíria Castelo Branco Lins;Izabela Domingues da Silva;,1;2;3;,"BARROS, H. O.;CASTELO BRANCO, W.;SILVA, I. D.;",
Mestrado,SER-TÃOECO- Aplicação da metodologia de Design Thinking em projetos orientados para a convivência com o semiárido paraibano,2021,Brasil,Português,VAZIO,091400000001,Centro de Estudos e Sistemas Avançados do Recife,VAZIO,Design,Walquíria Castelo Branco Lins;José Carlos Porto Arcoverde Junior;Erygeanny Machado de Lira;,1;2;3;,"CASTELO BRANCO, W.;ARCOVERDE JUNIOR, J. C. P.;LIRA, E. M.;",
Mestrado,O USO DA MÍDIA SOCIAL INSTAGRAM PELA EQUIPE DE COMUNICAÇÃO DO JARDIM BOTÂNICO DO RECIFE,2021,Brasil,Português,VAZIO,033800000001,Universidade Federal Rural de Pernambuco,VAZIO,Ensino das Ciências,Helaine Sivini Ferreira;Ivoneide Mendes da Silva;Walquíria Castelo Branco Lins;,1;2;3;,"FERREIRA, H. S.;SILVA, I. M.;CASTELO BRANCO, W.;",
Mestrado,Treinamento vivencial para resolução de conflitos: com aplicação de ferramentas de design,2021,Brasil,Português,VAZIO,091400000001,Centro de Estudos e Sistemas Avançados do Recife,VAZIO,Design,Walquíria Castelo Branco Lins;Yvana Oliveira de Alencastro;Daniel de Sant?anna Martins;,1;2;3;,"CASTELO BRANCO, W.;ALENCASTRO, Y. O.;MARTINS, D. S.;",
Mestrado,Contribuição do design de serviço para dar visibilidade a jornada home office das mulheres docentes do ensino superior a partir da crise pandémica,2021,Brasil,Português,VAZIO,091400000001,Centro de Estudos e Sistemas Avançados do Recife,VAZIO,Design,Walquíria Castelo Branco Lins;José Carlos Porto Arcoverde Junior;Ana Paula Gaspar Gonçalves;,1;2;3;,"CASTELO BRANCO, W.;ARCOVERDE JUNIOR, J. C. P.;GONCALVES, A. P. G.;",
Mestrado,A abordagem do Design de Serviço para o Redesenho do Serviço do Setor de Pós venda na Empresa de Móveis Planejados,2021,Brasil,Português,VAZIO,091400000001,Centro de Estudos e Sistemas Avançados do Recife,VAZIO,Design,Walquíria Castelo Branco Lins;Haidée Cristina Câmara Lima;Ana Paula Gaspar Gonçalves;,1;2;3;,"CASTELO BRANCO, W.;LIMA, H. C. C.;GONCALVES, A. P. G.;",
Mestrado,COMPETÊNCIAS DOCENTES PARA O ENSINO HÍBRIDO: CONSTRUÇÃO DE UM QUADRO REFERENCIAL,2021,Brasil,Português,VAZIO,002100000009,Universidade Federal de Pernambuco,VAZIO,Educação Matemática e Tecnológica,Walquíria Castelo Branco Lins;Maria Auxiliadora Soares Padilha;QUERTE TERESINHA CONZI MEHLECKE;,1;2;3;,"LINS, WALQUIRIA;PADILHA, M. A. S.;MEHLECKE, Q. T. C.;",
