TITLE,YEAR,LANG,EDITORA,AUTHOR,ORDER,ORDER_OK,ID,FULL_NAME,LAST_NAME,CITADO,CITY,STATE,RESUME,UPDATE,ADDRESS_ENTERP,ORCID
Novos modelos de negócio do jornalismo pernambucano diante das Indústrias Criativas,2018,Português,Editora FI,"['Maria Carolina Maia Monteiro', 'Dario Brito Rocha Júnior', 'Denny Anderson Farias Costa', 'João Guilherme de Melo Peixoto', 'Luiz Carlos Pinto da Costa Júnior']","['1', '2', '3', '4', '5']",['3'],3539280723617206,Denny Anderson Farias Costa,Costa,"COSTA, D. A. F.;A. F. COSTA, D.;A. F. COSTA, DENNY",Recife,PE,"Mestre em Indústrias Criativas pela Universidade Católica de Pernambuco e graduado em Jornalismo na Universidade Federal de Pernambuco. Tem como áreas de interesse: future studies, design crítico especulativo, mídia ubíqua e pervasiva, experiências ampliadas de comunicação e mobilidade informacional na pós-humanidade. Como projeto de conclusão de curso, escreveu um livro-reportagem com histórias de pessoas que tiveram a vida modificada pela visão. No mestrado, dissertou sobre sistemas de recomendação exercendo curadoria de informação ao microposicionar conteúdos geoetiquetados. Sua experiência profissional vai desde produtor, repórter e âncora em passagens por grandes redações de jornalismo como Rádio CBN, Rádio Globo e TV Globo, com produções para o Jornal Nacional, Fantástico e Globo News. Atua também como sócio e COO de uma agência de marketing digital e mídia de performance. Atualmente é professor no Centro de Estudos e Sistemas Avançados do Recife (CESAR). Enquanto jornalista, conquistou prêmios regionais e nacionais como o Prêmio Cristina Tavares, Prêmio Fecomércio, Prêmio Sebrae e Prêmio Petrobrás de Jornalismo, além de ser finalista do Prêmio CNI de Jornalismo em Brasília.",13-09-2022,,https://orcid.org/0000-0003-2352-6411
Analysis of Improved User Experience When Using AR in Public Spaces,2021,Inglês,Springer International Publishing,"['Barros, Vladimir', 'Oliveira, Eduardo', 'Luiz Francisco Alves de Araujo']","['1', '2', '3']",['3'],4137898857225049,Luiz Francisco Alves de Araujo,Araujo,"ARAUJO, Luiz Francisco A.;ARAÚJO, L.;de Araújo, Luiz F.;Luiz F. de Araújo;Araújo, Luiz",São Paulo,SP,"É doutorando em Design pela Universidade Federal de Pernambuco na área de artefatos digitais, possui mestrado (2015) e graduação em Design 1994) pela mesma instituição. É coordenador do curso de Bacharelado em Design da CESAR School e também atua como coordenador do curso de especialização em Design de Interação para Artefatos Digitais na mesma instituição. Atuou como coordenador do Curso Técnico de Nível Médio de Multimídia/Artes para Jogos Digitais na Escola Técnica Estadual Cícero Dias - Programa NAVE,  e também coordenou a especialização em Design de Interação na Faculdade Guararapes. &amp;#10;Dentro do Programa NAVE coordenou orientou mais de 60 projetos de jogos e artefatos digitais que somam mais de 800.000 downloads nas lojas do Google Play e Microsoft Store, muitos destes projetos foram premiados em eventos como: Festival de Jogos Independentes do SBGames; competições de hackathon da Microsoft; Technovation Challenge; Concurso INOVApps do Ministério das Comunicações; dentre outros. Coordenou também projetos de animações selecionados e premiados em diversos festivais nacionais e internacionais como o Anima Mundi,  Festival Pequeno Cineasta, Mostra Geração - Festival do Rio, I.N.S.A.N.E. Festival, Grenada Aftergow e Fayette Film Fest.&amp;#10;Trabalhou mais de 18 anos na área de comunicação e design para várias empresas e instituições destacando projetos como: o livro/ações ?Comedoria Popular?, patrocinado pelo Fundo Pernambucano de Incentivo à Cultura - FUNCULTURA; &amp;quot;Direito do Consumidor nas Ruas&amp;quot; da ADECCON, financiado pelo Ministério da Justiça; projeto DVD-ROM da &amp;quot;Sala especial Paulo Bruscky&amp;quot; para Bienal de Artes de São Paulo 2004, projeto patrocinado pelo Centro Cultural Brasil Alemanha - CCBA e Consulado Alemão.",10-09-2021,Centro de Estudos e Sistemas Avançados do Recife,https://orcid.org/0000-0002-4610-6586
Aplicação da Inteligência Computacional no Judiciário,2022,Português,FGV,"['André Câmara', 'José Leovigildo Coelho', 'Péricles B. C. de Miranda', 'Rafael Ferreira Leite de Mello']","['1', '2', '3', '4']",['4'],6190254569597745,Rafael Ferreira Leite de Mello,Mello,"Rafael Ferreira;Ferreira, Rafael;Rafael Mello;RAFAEL MELLO;MELLO, RAFAEL FE;FERREIRA'MELLO, RAFAEL;MELLO, RAFAEL FERREIRA;Ferreira Mello, Rafael;Rafael Ferreira Mello;MELLO, RAFAEL FERREIRA LEITE DE;MELLO, RAFAEL;FERREIRAMELLO, RAFAEL;MELLO, RAFAEL F. L.",Arapiraca,AL,"Rafael Ferreira Mello é doutor em ciência da computação com interesses de pesquisa que abrangem processamento de linguagem natural, learning analytics e tecnologia educacional. Ele é professor na Universidade Federal Rural de Pernambuco e no Cesar School, no Brasil, onde é um dos coordenadores do Laboratório de Inteligência Artificial (https://aiboxlab.org/), que desenvolve várias iniciativas relacionadas a learning analytics (LA). Dr. Mello realizou pós-doutorado na Escola de Informática da Universidade de Edimburgo em 2018, onde continua a ter colaborações. Ele trabalha em vários projetos de pesquisa multinacionais, que envolvem parceiros acadêmicos e empresas na Europa, Austrália, Estados Unidos e América Latina. A experiência anterior do Dr. Mello também inclui um projeto de pesquisa financiado pela Hewlett-Packard, onde atuou como líder técnico. Um tema-chave de sua pesquisa recente tem sido o uso do processamento de linguagem natural aplicados como educação e temas mais focados em análise de textos como sumarização e classificação.",08-01-2023,Universidade Federal Rural de Pernambuco,https://orcid.org/0000-0003-3548-9670
DESENVOLVIMENTO DE TECNOLOGIAS PARA A EDUCAÇÃO MATEMÁTICA AVANÇOS E DESAFIOS,2010,Português,SBEM,"['Franck Bellemain', 'Verônica Gitirana Gomes Ferreira', 'Paula Moreira Baltar Bellemain', 'Juliana Pereira Gonçalves de Andrade Araripe']","['1', '2', '3', '4']",['4'],2998997633579495,Juliana Pereira Gonçalves de Andrade Araripe,Araripe,VAZIO,Recife,PE,"Possui graduação em Licenciatura Plena em Matemática pela Universidade de Pernambuco (2006) e mestrado em Educação Matemática e Tecnológica pelo Programa de Pós Graduação em Educação Matemática e Tecnológica na Universidade Federal de Pernambuco (2010). É Professora Substituta lotada no Departamento de Métodos e Técnicas de Ensino na UFPE e possui interesse processos de aprendizagem matemática suportada pelas tecnologias educacionais, Representação Semiótica, aprendizagem à distância, aprendizagem colaborativa suportada por computador(CSCL), Engenharia de Softwares Educativo, Abordagem Documental e Orquestração Instrumental.",01-02-2016,Universidade Federal de Pernambuco,VAZIO
Real-Time Head Pose Estimation for Mobile Devices,2012,Português,Springer Berlin Heidelberg,"['Neto, Euclides N. Arcoverde', 'BARRETO, RAFAEL M.', 'Duarte, Rafael M.', 'Joao Paulo Magalhaes', 'Bastos, Carlos A. C. M.', 'Ren, Tsang Ing', 'CAVALCANTI, GEORGE D. C.']","['1', '2', '3', '4', '5', '6', '7']",['4'],6745827031682849,Joao Paulo Magalhaes,Magalhaes,"MAGALHAES, J. P.;MAGALHAES, JOAO PAULO;Magalhaes, Joao Paulo",Recife,PE,"Mestre em Ciências da Computação pelo Centro de Informática da Universidade Federal de Pernambuco (UFPE) em 2010, com foco em visão computacional, aprendizagem de maquinas e processamento de imagens. Possui graduação em Engenharia da Computação também pela UFPE (2008). Desenvolveu pesquisas acadêmicas vinculadas ao VIISAR (Grupo de pesquisas em Visão Computacional da UFPE) e a instituições de pesquisa e desenvolvimento como o Centro de Estudos e Sistemas Avançados do Recife (C.E.S.A.R.), tendo publicado artigos nas áreas de visão computacional, aprendizagem de máquinas, processamento de imagens e dispositivos móveis. &amp;#10;&amp;#10;Com mais de doze anos de experiência profissional, sempre manteve seu trabalho relacionado a pesquisa e desenvolvimento de novas tecnologias, produtos e empresas, com destaque para os mais de 5 anos com dedicação ao C.E.S.A.R. - onde trabalha diretamente com empresas líderes nos mercados nacional e internacional, como a SAMSUNG, Motorola, LG e outras. Atua como líder técnico e de equipes em projetos de pesquisa e desenvolvimento nas áreas de Ciência de Dados, Aprendizagem de Máquinas e novas tecnologias, em geral, como Internet das Coisas e outras. Além disso, também atua como professor em cursos de Graduação, Especialização / Pós Graduação e Extensão em disciplinas técnicas de Aprendizagem de Máquinas e de Inteligência Artificial e Novas Tecnologias, como os Produtos Inteligentes e Conectados, em cursos executivos.&amp;#10;&amp;#10;Tem interesse constante na criação e engenharia de novos produtos e serviços de base tecnológica. Especialista em Aprendizagem de Máquinas. Possui sólida experiência na arquitetura de sistemas distribuídos, principalmente envolvendo dispositivos móveis, embarcados e IoT (Internet das Coisas).&amp;#10;Mantém interesse acadêmico nas áreas de Inteligência e Visão Computacional, Aprendizagem de Máquinas, Ciências de Dados e novas tecnologias em geral.",04-03-2022,CESAR School,
Using Artificial Intelligence for Augmentative Alternative Communication for Children with Disabilities,2019,Português,Springer International Publishing,"['Neamtu, Rodica', 'Camara, André', 'Pereira, Carlos', 'Rafael Ferreira Leite de Mello']","['1', '2', '3', '4']",['4'],6190254569597745,Rafael Ferreira Leite de Mello,Mello,"Rafael Ferreira;Ferreira, Rafael;Rafael Mello;RAFAEL MELLO;MELLO, RAFAEL FE;FERREIRA'MELLO, RAFAEL;MELLO, RAFAEL FERREIRA;Ferreira Mello, Rafael;Rafael Ferreira Mello;MELLO, RAFAEL FERREIRA LEITE DE;MELLO, RAFAEL;FERREIRAMELLO, RAFAEL;MELLO, RAFAEL F. L.",Arapiraca,AL,"Rafael Ferreira Mello é doutor em ciência da computação com interesses de pesquisa que abrangem processamento de linguagem natural, learning analytics e tecnologia educacional. Ele é professor na Universidade Federal Rural de Pernambuco e no Cesar School, no Brasil, onde é um dos coordenadores do Laboratório de Inteligência Artificial (https://aiboxlab.org/), que desenvolve várias iniciativas relacionadas a learning analytics (LA). Dr. Mello realizou pós-doutorado na Escola de Informática da Universidade de Edimburgo em 2018, onde continua a ter colaborações. Ele trabalha em vários projetos de pesquisa multinacionais, que envolvem parceiros acadêmicos e empresas na Europa, Austrália, Estados Unidos e América Latina. A experiência anterior do Dr. Mello também inclui um projeto de pesquisa financiado pela Hewlett-Packard, onde atuou como líder técnico. Um tema-chave de sua pesquisa recente tem sido o uso do processamento de linguagem natural aplicados como educação e temas mais focados em análise de textos como sumarização e classificação.",08-01-2023,Universidade Federal Rural de Pernambuco,https://orcid.org/0000-0003-3548-9670
A Hypermedia-based Adaptive Educational System for Assisting Students in Systems and Information Technology Domain for Accountability,2016,Português,Springer International Publishing,"['Vidal, Inés Maria González', 'de Barros Costa, Evandro', 'da Silva, Leandro Dias', 'de Araújo, Fabrísia Ferreira', 'Rafael Ferreira Leite de Mello']","['1', '2', '3', '4', '5']",['5'],6190254569597745,Rafael Ferreira Leite de Mello,Mello,"Rafael Ferreira;Ferreira, Rafael;Rafael Mello;RAFAEL MELLO;MELLO, RAFAEL FE;FERREIRA'MELLO, RAFAEL;MELLO, RAFAEL FERREIRA;Ferreira Mello, Rafael;Rafael Ferreira Mello;MELLO, RAFAEL FERREIRA LEITE DE;MELLO, RAFAEL;FERREIRAMELLO, RAFAEL;MELLO, RAFAEL F. L.",Arapiraca,AL,"Rafael Ferreira Mello é doutor em ciência da computação com interesses de pesquisa que abrangem processamento de linguagem natural, learning analytics e tecnologia educacional. Ele é professor na Universidade Federal Rural de Pernambuco e no Cesar School, no Brasil, onde é um dos coordenadores do Laboratório de Inteligência Artificial (https://aiboxlab.org/), que desenvolve várias iniciativas relacionadas a learning analytics (LA). Dr. Mello realizou pós-doutorado na Escola de Informática da Universidade de Edimburgo em 2018, onde continua a ter colaborações. Ele trabalha em vários projetos de pesquisa multinacionais, que envolvem parceiros acadêmicos e empresas na Europa, Austrália, Estados Unidos e América Latina. A experiência anterior do Dr. Mello também inclui um projeto de pesquisa financiado pela Hewlett-Packard, onde atuou como líder técnico. Um tema-chave de sua pesquisa recente tem sido o uso do processamento de linguagem natural aplicados como educação e temas mais focados em análise de textos como sumarização e classificação.",08-01-2023,Universidade Federal Rural de Pernambuco,https://orcid.org/0000-0003-3548-9670
Trust and Knowing: Emerging Technologies and Mobility in the Global South,2019,Inglês,,"['Sarah Pink', 'Rosamaria Belo Lucena', 'Jananda da Silva Pinto', 'Angélica Porto Cavalcanti de Souza', 'Camille Nascimento Santiago Caminha', 'Geraldina Maria de Siqueira', 'Mariana Duarte de Oliveira']","['1', '2', '3', '4', '5', '6', '7']",['5'],8797260915259688,Camille Nascimento Santiago Caminha,Caminha,VAZIO,,,"Mestre Design, com ênfase em Artefatos Digitais pela Universidade Federal de Pernambuco e graduada em Design pela mesma universidade (2010), possui conhecimentos e experiência na área de Research, UX/UI, comunicação e marketing, além de ter realizado projetos com métodos de design na concepção de produtos inovadores. Atualmente trabalha no CESAR como UX/UI design. Atuou também com pesquisas em Design no projeto NUX - Natural User Experience, no CIN/UFPE. Possui interesses de atuação direcionados a metodologias, métodos, técnicas e processos de design, artefatos digitais e Usabilidade. 
Participação em eventos como facilitadora de workshop no P&amp;D Design 2018 e SBTI 2018, apresentação de artigos no SBTI 2019, P&amp;D Design 2018, SBTI 2018 e IHC 2O17, participação na banca avaliadora de três projetos de conclusão de curso do Curso técnico de Comunicação Visual, no CTCD (Centro Tecnológico da Cultura Digital). Participação no Conaerg 2016 - 1° Congresso Internacional de Ergonomia Aplicada. Premiação de 3º melhor artigo no SBTI 2018.",11-12-2019,,VAZIO
A Systematic Approach for Designing Educational Recommender Systems,2011,Inglês,,"['Patrick Brito', 'Ig Ibert', 'Aydano P. Machado', 'Evandro de Bastos Costa', 'Olavo Holanda', 'Rafael Ferreira Leite de Mello']","['1', '2', '3', '4', '5', '6']",['6'],6190254569597745,Rafael Ferreira Leite de Mello,Mello,"Rafael Ferreira;Ferreira, Rafael;Rafael Mello;RAFAEL MELLO;MELLO, RAFAEL FE;FERREIRA'MELLO, RAFAEL;MELLO, RAFAEL FERREIRA;Ferreira Mello, Rafael;Rafael Ferreira Mello;MELLO, RAFAEL FERREIRA LEITE DE;MELLO, RAFAEL;FERREIRAMELLO, RAFAEL;MELLO, RAFAEL F. L.",Arapiraca,AL,"Rafael Ferreira Mello é doutor em ciência da computação com interesses de pesquisa que abrangem processamento de linguagem natural, learning analytics e tecnologia educacional. Ele é professor na Universidade Federal Rural de Pernambuco e no Cesar School, no Brasil, onde é um dos coordenadores do Laboratório de Inteligência Artificial (https://aiboxlab.org/), que desenvolve várias iniciativas relacionadas a learning analytics (LA). Dr. Mello realizou pós-doutorado na Escola de Informática da Universidade de Edimburgo em 2018, onde continua a ter colaborações. Ele trabalha em vários projetos de pesquisa multinacionais, que envolvem parceiros acadêmicos e empresas na Europa, Austrália, Estados Unidos e América Latina. A experiência anterior do Dr. Mello também inclui um projeto de pesquisa financiado pela Hewlett-Packard, onde atuou como líder técnico. Um tema-chave de sua pesquisa recente tem sido o uso do processamento de linguagem natural aplicados como educação e temas mais focados em análise de textos como sumarização e classificação.",08-01-2023,Universidade Federal Rural de Pernambuco,https://orcid.org/0000-0003-3548-9670
Analysis of Choreographed Human Movements Using Depth Cameras: A Systematic Review,2016,Português,Springer International Publishing,"['Ribeiro, Danilo', 'Lima, Clodoaldo', 'Bernardes, João', 'Roman, Norton', 'Antunes, Marcelo', 'Ortega, Enrique', 'Antonio Willian Sousa', 'Digiampietri, Luciano', 'Cura, Luis', 'Silva, Valdinei']","['1', '10', '2', '3', '4', '5', '6', '7', '8', '9']",['6'],1310087115891977,Antonio Willian Sousa,Sousa,"SOUSA, A. W.;Sousa, Antonio;Sousa, Antonio W.",ITAPIPOCA,CE,"Possui mestrado em Processamento de Linguagem Natural pela Universidade Federal do Paraná e graduação em Análise e Desenvolvimento de Sistemas pelo Centro Estadual de Educação Tecnológica Paula Souza. Atua no desenvolvimento de sistemas de reconhecimento, detecção e segmentação de imagens. Tem experiência na área de Ciência da Computação, com ênfase em Aprendizagem de Máquina, atuando principalmente nos seguintes temas: aprendizagem de máquina, redes neurais, reconhecimento de imagens, processamento de linguagem natural, processamento de linguagem natual e rastreamento do olhar.",11-02-2022,,
