INSTITUTION,YEAR_INI,YEAR_FIN,MONTH_INI,MONTH_FIN,COURSE,TYPE,DISC,ID,FULL_NAME,LAST_NAME,CITADO,CITY,STATE,RESUME,UPDATE,ADDRESS_ENTERP,ORCID
Universidade Federal de Pernambuco,2003,,ATUAL,ATUAL,Curso Sequencial em Testes - CIn/Motorola,ESPECIALIZACAO,['Arquitetura de Software para Celulares'],0266043277510432,Tiago Guedes Ferreira Barros,Barros,"BARROS, T.;BARROS, TIAGO;BARROS, T. G. F.;BARROS, TIAGO G. F.",Recife,PE,"Tiago Barros é o Engenheiro Chefe de IoT no CESAR, responsável pela coordenação do Grupo de Pesquisa em IoT e por projetar e implementar a meta-plataforma KNoT Network of Things. Tiago é o representante do CESAR na Comissão Brasileira de Comunicações (CBC 3) da ANATEL que lida com a padronização das telecomunicações no Brasil, sendo responsável por redigir recomendações para a Comissão de Estudos 20 da ITU-T que trata de Internet das Coisas, comunidades e cidades inteligentes. Tiago Barros também é professor convidado do curso de pós-graduação em arquitetura de software para dispositivos móveis da UFPE / CIn / Motorola há mais de 15 anos. Ele também leciona disciplinas de prototipação eletrônica nos cursos de Ciência da Computação e Mestrado em Design no CESAR e na UFPE desde 2009. Em 2016, Tiago começou uma das primeiras especializações em IoT do país, na CESAR.School, sendo o coordenador responsável por definir toda a parte pedagógica, disciplinas e conteúdos do curso. Tiago possui mestrado em Ciência da Computação (UFPE-2007), B.Sc. em Ciência da Computação (UFPE-2003) e Técnico em Eletrônica (ETFPE-1998), com mais de 24 anos de experiência em desenvolvimento de software, com ênfase em Internet das Coisas, sistemas embarcados de tempo real, arquitetura de software e protocolos de comunicação.",16-09-2022,Centro de Estudos e Sistemas Avançados do Recife,
CESAR EDU,2010,12.0,12,12,TECNOLOGIAS PARA DES. DE APLICAÇÕES MÓVEIS,ESPECIALIZACAO,['Interfaces Físicas para Dispositivos Móveis'],0266043277510432,Tiago Guedes Ferreira Barros,Barros,"BARROS, T.;BARROS, TIAGO;BARROS, T. G. F.;BARROS, TIAGO G. F.",Recife,PE,"Tiago Barros é o Engenheiro Chefe de IoT no CESAR, responsável pela coordenação do Grupo de Pesquisa em IoT e por projetar e implementar a meta-plataforma KNoT Network of Things. Tiago é o representante do CESAR na Comissão Brasileira de Comunicações (CBC 3) da ANATEL que lida com a padronização das telecomunicações no Brasil, sendo responsável por redigir recomendações para a Comissão de Estudos 20 da ITU-T que trata de Internet das Coisas, comunidades e cidades inteligentes. Tiago Barros também é professor convidado do curso de pós-graduação em arquitetura de software para dispositivos móveis da UFPE / CIn / Motorola há mais de 15 anos. Ele também leciona disciplinas de prototipação eletrônica nos cursos de Ciência da Computação e Mestrado em Design no CESAR e na UFPE desde 2009. Em 2016, Tiago começou uma das primeiras especializações em IoT do país, na CESAR.School, sendo o coordenador responsável por definir toda a parte pedagógica, disciplinas e conteúdos do curso. Tiago possui mestrado em Ciência da Computação (UFPE-2007), B.Sc. em Ciência da Computação (UFPE-2003) e Técnico em Eletrônica (ETFPE-1998), com mais de 24 anos de experiência em desenvolvimento de software, com ênfase em Internet das Coisas, sistemas embarcados de tempo real, arquitetura de software e protocolos de comunicação.",16-09-2022,Centro de Estudos e Sistemas Avançados do Recife,
CESAR EDU,2015,12.0,12,12,Mestrado em Design,POS-GRADUACAO,['Prototipação Eletrônica'],0266043277510432,Tiago Guedes Ferreira Barros,Barros,"BARROS, T.;BARROS, TIAGO;BARROS, T. G. F.;BARROS, TIAGO G. F.",Recife,PE,"Tiago Barros é o Engenheiro Chefe de IoT no CESAR, responsável pela coordenação do Grupo de Pesquisa em IoT e por projetar e implementar a meta-plataforma KNoT Network of Things. Tiago é o representante do CESAR na Comissão Brasileira de Comunicações (CBC 3) da ANATEL que lida com a padronização das telecomunicações no Brasil, sendo responsável por redigir recomendações para a Comissão de Estudos 20 da ITU-T que trata de Internet das Coisas, comunidades e cidades inteligentes. Tiago Barros também é professor convidado do curso de pós-graduação em arquitetura de software para dispositivos móveis da UFPE / CIn / Motorola há mais de 15 anos. Ele também leciona disciplinas de prototipação eletrônica nos cursos de Ciência da Computação e Mestrado em Design no CESAR e na UFPE desde 2009. Em 2016, Tiago começou uma das primeiras especializações em IoT do país, na CESAR.School, sendo o coordenador responsável por definir toda a parte pedagógica, disciplinas e conteúdos do curso. Tiago possui mestrado em Ciência da Computação (UFPE-2007), B.Sc. em Ciência da Computação (UFPE-2003) e Técnico em Eletrônica (ETFPE-1998), com mais de 24 anos de experiência em desenvolvimento de software, com ênfase em Internet das Coisas, sistemas embarcados de tempo real, arquitetura de software e protocolos de comunicação.",16-09-2022,Centro de Estudos e Sistemas Avançados do Recife,
CESAR School,2017,,ATUAL,ATUAL,Especialização em Internet das Coisas,ESPECIALIZACAO,"['Introdução à internet das coisas', 'Introdução à plataforma KNoT', 'Construção de objetos conectados']",0266043277510432,Tiago Guedes Ferreira Barros,Barros,"BARROS, T.;BARROS, TIAGO;BARROS, T. G. F.;BARROS, TIAGO G. F.",Recife,PE,"Tiago Barros é o Engenheiro Chefe de IoT no CESAR, responsável pela coordenação do Grupo de Pesquisa em IoT e por projetar e implementar a meta-plataforma KNoT Network of Things. Tiago é o representante do CESAR na Comissão Brasileira de Comunicações (CBC 3) da ANATEL que lida com a padronização das telecomunicações no Brasil, sendo responsável por redigir recomendações para a Comissão de Estudos 20 da ITU-T que trata de Internet das Coisas, comunidades e cidades inteligentes. Tiago Barros também é professor convidado do curso de pós-graduação em arquitetura de software para dispositivos móveis da UFPE / CIn / Motorola há mais de 15 anos. Ele também leciona disciplinas de prototipação eletrônica nos cursos de Ciência da Computação e Mestrado em Design no CESAR e na UFPE desde 2009. Em 2016, Tiago começou uma das primeiras especializações em IoT do país, na CESAR.School, sendo o coordenador responsável por definir toda a parte pedagógica, disciplinas e conteúdos do curso. Tiago possui mestrado em Ciência da Computação (UFPE-2007), B.Sc. em Ciência da Computação (UFPE-2003) e Técnico em Eletrônica (ETFPE-1998), com mais de 24 anos de experiência em desenvolvimento de software, com ênfase em Internet das Coisas, sistemas embarcados de tempo real, arquitetura de software e protocolos de comunicação.",16-09-2022,Centro de Estudos e Sistemas Avançados do Recife,
CESAR School,2017,,ATUAL,ATUAL,Mestrado em Design,POS-GRADUACAO,"['Prototipação Eletrônica', 'Introdução à Internet das Coisas']",0266043277510432,Tiago Guedes Ferreira Barros,Barros,"BARROS, T.;BARROS, TIAGO;BARROS, T. G. F.;BARROS, TIAGO G. F.",Recife,PE,"Tiago Barros é o Engenheiro Chefe de IoT no CESAR, responsável pela coordenação do Grupo de Pesquisa em IoT e por projetar e implementar a meta-plataforma KNoT Network of Things. Tiago é o representante do CESAR na Comissão Brasileira de Comunicações (CBC 3) da ANATEL que lida com a padronização das telecomunicações no Brasil, sendo responsável por redigir recomendações para a Comissão de Estudos 20 da ITU-T que trata de Internet das Coisas, comunidades e cidades inteligentes. Tiago Barros também é professor convidado do curso de pós-graduação em arquitetura de software para dispositivos móveis da UFPE / CIn / Motorola há mais de 15 anos. Ele também leciona disciplinas de prototipação eletrônica nos cursos de Ciência da Computação e Mestrado em Design no CESAR e na UFPE desde 2009. Em 2016, Tiago começou uma das primeiras especializações em IoT do país, na CESAR.School, sendo o coordenador responsável por definir toda a parte pedagógica, disciplinas e conteúdos do curso. Tiago possui mestrado em Ciência da Computação (UFPE-2007), B.Sc. em Ciência da Computação (UFPE-2003) e Técnico em Eletrônica (ETFPE-1998), com mais de 24 anos de experiência em desenvolvimento de software, com ênfase em Internet das Coisas, sistemas embarcados de tempo real, arquitetura de software e protocolos de comunicação.",16-09-2022,Centro de Estudos e Sistemas Avançados do Recife,
Faculdade SENAC,2013,,ATUAL,ATUAL,Tecnológico Superior em Design de Moda,GRADUACAO,"['Estilo', 'Moda, Cultura e Sociedade', 'História da Moda Comtemporânea', 'História da Moda I', 'Planejamento e Desenvolvimento de Coleção II', 'Design de Superfície']",0342261677880699,Tatalina Cristina Silva de Oliveira,Oliveira,"OLIVEIRA, T. C. S.",Recife,PE,"Inquieta, criativa e comunicativa. Aficionada por esportes, adrenalina e arte. Observadora nata de pessoas e suas formas de consumo, o que me leva à paixão pelos estudos de tendência de comportamento (trendhunter). Designer de formação, com uma trajetória profissional que me levou à moda e antropologia, docência, palestras e consultorias. Experiente em gerir projetos, grupos, elaborar parcerias entre instituições e desenvolver pesquisas que envolvam diversidade e inclusão.  Interesse por inovação, moda e sua relação com gênero, negritude e questões socioculturais,bem como com memória gráfica, história da arte e do design, estudos de consumo, com foco em cultura material.&amp;#10;&amp;#10;Doutorado  (2018) e Mestrado (2010) em Design pelo Programa de pós-graduação em Design da UFPE (2018).Especialização (2011) em Antropologia Social e Cultural pelo Instituto de Ciências Sociais da Universidade de Lisboa - Portugal  (ICS-UL). Graduada pelo Centro Federal de Educação Tecnológica de Pernambuco (2006) no Curso Superior de Tecnologia em Design Gráfico.",29-11-2022,,
Faculdade SENAC,2014,5.0,05,05,Especialização em Produção de Moda e Styling,POS-GRADUACAO,['Moda Contemporânea'],0342261677880699,Tatalina Cristina Silva de Oliveira,Oliveira,"OLIVEIRA, T. C. S.",Recife,PE,"Inquieta, criativa e comunicativa. Aficionada por esportes, adrenalina e arte. Observadora nata de pessoas e suas formas de consumo, o que me leva à paixão pelos estudos de tendência de comportamento (trendhunter). Designer de formação, com uma trajetória profissional que me levou à moda e antropologia, docência, palestras e consultorias. Experiente em gerir projetos, grupos, elaborar parcerias entre instituições e desenvolver pesquisas que envolvam diversidade e inclusão.  Interesse por inovação, moda e sua relação com gênero, negritude e questões socioculturais,bem como com memória gráfica, história da arte e do design, estudos de consumo, com foco em cultura material.&amp;#10;&amp;#10;Doutorado  (2018) e Mestrado (2010) em Design pelo Programa de pós-graduação em Design da UFPE (2018).Especialização (2011) em Antropologia Social e Cultural pelo Instituto de Ciências Sociais da Universidade de Lisboa - Portugal  (ICS-UL). Graduada pelo Centro Federal de Educação Tecnológica de Pernambuco (2006) no Curso Superior de Tecnologia em Design Gráfico.",29-11-2022,,
Faculdade SENAC,2016,5.0,05,05,Especialização em Modelagem e Criação,POS-GRADUACAO,['Orientação de TCCs'],0342261677880699,Tatalina Cristina Silva de Oliveira,Oliveira,"OLIVEIRA, T. C. S.",Recife,PE,"Inquieta, criativa e comunicativa. Aficionada por esportes, adrenalina e arte. Observadora nata de pessoas e suas formas de consumo, o que me leva à paixão pelos estudos de tendência de comportamento (trendhunter). Designer de formação, com uma trajetória profissional que me levou à moda e antropologia, docência, palestras e consultorias. Experiente em gerir projetos, grupos, elaborar parcerias entre instituições e desenvolver pesquisas que envolvam diversidade e inclusão.  Interesse por inovação, moda e sua relação com gênero, negritude e questões socioculturais,bem como com memória gráfica, história da arte e do design, estudos de consumo, com foco em cultura material.&amp;#10;&amp;#10;Doutorado  (2018) e Mestrado (2010) em Design pelo Programa de pós-graduação em Design da UFPE (2018).Especialização (2011) em Antropologia Social e Cultural pelo Instituto de Ciências Sociais da Universidade de Lisboa - Portugal  (ICS-UL). Graduada pelo Centro Federal de Educação Tecnológica de Pernambuco (2006) no Curso Superior de Tecnologia em Design Gráfico.",29-11-2022,,
Paulo Roberio Tenorio Pessoa ME,2009,1.0,1,1,,OUTRO,"['Desenho Técnico Assitido por Computador', 'Desenvolvimento Web', 'Computação Gráfica', 'Introdução à Computação']",1593547313200045,Diego de Freitas Bezerra,Bezerra,"BEZERRA, D. F.;DE FREITAS BEZERRA, DIEGO;BEZERRA, DIEGO",Garanhuns,PE,"Possui graduação em Ciência da Computação e mestrado em Informática Aplicada pela Universidade Federal Rural de Pernambuco (UFRPE). Atualmente é aluno de doutorado em Ciência da Computação pela Universidade Federal de Pernambuco (UFPE) e atua como pesquisador na Iara Engenharia e Tecnologia Ltda e no Grupo de Pesquisa em Realidade Virtual e Multimídia (GRVM-UFPE). Tem experiência na área de Ciência da Computação, com ênfase em Metodologia e Técnicas da Computação, atuando principalmente nos seguintes temas: aprendizagem de máquina, sistemas de eventos discretos e internet das coisas.",20-12-2022,Universidade Federal de Pernambuco,https://orcid.org/0000-0002-9933-091X
Instituto Federal de Educação Ciência e Tecnologia do Norte de Minas Gerais,2021,3.0,3,3,,OUTRO,"['Desenvolvimento de Sistemas (Programação Orientada a Objetos) - Técnico em Informática', 'Programação Web 1 - Técnico em Informática', 'Tópicos Especiais - Técnico em Informática']",1593547313200045,Diego de Freitas Bezerra,Bezerra,"BEZERRA, D. F.;DE FREITAS BEZERRA, DIEGO;BEZERRA, DIEGO",Garanhuns,PE,"Possui graduação em Ciência da Computação e mestrado em Informática Aplicada pela Universidade Federal Rural de Pernambuco (UFRPE). Atualmente é aluno de doutorado em Ciência da Computação pela Universidade Federal de Pernambuco (UFPE) e atua como pesquisador na Iara Engenharia e Tecnologia Ltda e no Grupo de Pesquisa em Realidade Virtual e Multimídia (GRVM-UFPE). Tem experiência na área de Ciência da Computação, com ênfase em Metodologia e Técnicas da Computação, atuando principalmente nos seguintes temas: aprendizagem de máquina, sistemas de eventos discretos e internet das coisas.",20-12-2022,Universidade Federal de Pernambuco,https://orcid.org/0000-0002-9933-091X
Instituto Federal de Educação Ciência e Tecnologia do Norte de Minas Gerais,2021,3.0,3,3,Sistemas de Informação,GRADUACAO,"['Sistemas Distribuídos', 'Tópicos Especiais']",1593547313200045,Diego de Freitas Bezerra,Bezerra,"BEZERRA, D. F.;DE FREITAS BEZERRA, DIEGO;BEZERRA, DIEGO",Garanhuns,PE,"Possui graduação em Ciência da Computação e mestrado em Informática Aplicada pela Universidade Federal Rural de Pernambuco (UFRPE). Atualmente é aluno de doutorado em Ciência da Computação pela Universidade Federal de Pernambuco (UFPE) e atua como pesquisador na Iara Engenharia e Tecnologia Ltda e no Grupo de Pesquisa em Realidade Virtual e Multimídia (GRVM-UFPE). Tem experiência na área de Ciência da Computação, com ênfase em Metodologia e Técnicas da Computação, atuando principalmente nos seguintes temas: aprendizagem de máquina, sistemas de eventos discretos e internet das coisas.",20-12-2022,Universidade Federal de Pernambuco,https://orcid.org/0000-0002-9933-091X
Centro de Estudos e Sistemas Avançados do Recife,2022,8.0,8,8,Ciência da Computação,GRADUACAO,['Algoritmos e Estruturas de Dados'],1593547313200045,Diego de Freitas Bezerra,Bezerra,"BEZERRA, D. F.;DE FREITAS BEZERRA, DIEGO;BEZERRA, DIEGO",Garanhuns,PE,"Possui graduação em Ciência da Computação e mestrado em Informática Aplicada pela Universidade Federal Rural de Pernambuco (UFRPE). Atualmente é aluno de doutorado em Ciência da Computação pela Universidade Federal de Pernambuco (UFPE) e atua como pesquisador na Iara Engenharia e Tecnologia Ltda e no Grupo de Pesquisa em Realidade Virtual e Multimídia (GRVM-UFPE). Tem experiência na área de Ciência da Computação, com ênfase em Metodologia e Técnicas da Computação, atuando principalmente nos seguintes temas: aprendizagem de máquina, sistemas de eventos discretos e internet das coisas.",20-12-2022,Universidade Federal de Pernambuco,https://orcid.org/0000-0002-9933-091X
Faculdade do Vale do Ipojuca,2010,12.0,12,12,Publicidade e Propaganda,GRADUACAO,"['Direção de arte publicitária', 'Design &amp;amp; computação gráfica', 'Design &amp;amp; Multimídia', 'Design &amp;amp; Produção Gráfica']",2090354558590542,Rodrigo Rios de Larrazabal,Larrazabal,"LARRAZABAL, R. R.",Recife,PE,"Graduado em Design pelo IFPE (2006), especialista em Design da Informação pela UFPE (2009) e mestre em Design de artefatos digitais pelo C.E.S.A.R.(2017). Rodrigo Rios é Design Thinker certificado pelo Design Thinkers Academy Brasil, professor de graduação e pós-graduação e já lecionou nas faculdades IBRATEC, UNIFAVIP, UNIFG e UNINABUCO. Além de ter experiência profissional de mercado, onde já trabalhou em escritórios de design e agências de publicidade como Italo Bianchi e Atma Bianchi. Hoje é professor da graduação de Design da CESAR School pela manhã e à tarde empreende em um estúdio de design, Artemis Estúdio de Ideias (www.artemis.rec.br).",07-12-2022,Centro de Estudos e Sistemas Avançados do Recife,
Faculdade Joaquim Nabuco,2010,2.0,2,2,Publicidade e Propaganda,GRADUACAO,"['Direção de arte publicitária', 'Planejamento visual']",2090354558590542,Rodrigo Rios de Larrazabal,Larrazabal,"LARRAZABAL, R. R.",Recife,PE,"Graduado em Design pelo IFPE (2006), especialista em Design da Informação pela UFPE (2009) e mestre em Design de artefatos digitais pelo C.E.S.A.R.(2017). Rodrigo Rios é Design Thinker certificado pelo Design Thinkers Academy Brasil, professor de graduação e pós-graduação e já lecionou nas faculdades IBRATEC, UNIFAVIP, UNIFG e UNINABUCO. Além de ter experiência profissional de mercado, onde já trabalhou em escritórios de design e agências de publicidade como Italo Bianchi e Atma Bianchi. Hoje é professor da graduação de Design da CESAR School pela manhã e à tarde empreende em um estúdio de design, Artemis Estúdio de Ideias (www.artemis.rec.br).",07-12-2022,Centro de Estudos e Sistemas Avançados do Recife,
Fundação de Apoio ao Desenvolvimento da Universidade Federal de Pernambuco,2001,11.0,11,11,,OUTRO,['Oficina de Roteiro Cinematográfico'],2695085711637635,Leo Falcão,Falcão,"FALCÃO, Leo;FALCÃO, L.;FALCÃO, Leonardo Henrique Lago;FALCÃO, Leonardo H L",Recife,PE,"Doutor pelo Programa de Pós-Graduação em Design pela UFPE, especialista em Estudos Cinematográficos pela UNICAP e graduado em Comunicação Social pela UFPE. Tem uma carreira premiada como roteirista, diretor e produtor de cinema e TV, além de manter seu trabalho como músico. Nos últimos anos, tem estendido sua experiência para outros meios narrativos como literatura, teatro e áreas experimentais, tornando-se uma referência em projetos transmídia e narrativas contemporâneas. Foi vencedor do prêmio Young Creative Entrepreneur Award, promovido pelo British Council em 2012 ? e um dos artistas brasileiros selecionados para o Programa The Playable City, uma residência artística no Pervasive Media Studio em Bristol, Reino Unido, com o apoio do British Council e do Porto Digital. Seus interesses de pesquisa acadêmica e artística abrangem processos de criação e produção em formatos narrativos diversos: artes e narrativas contemporâneas, cinema (roteiro e direção), games, novas mídias, televisão, quadrinhos, música e publicidade. Foi por vários anos docente da UNICAP e atualmente é professor, pesquisador e designer de narrativas na CESAR School.",14-10-2022,Centro de Estudos e Sistemas Avançados do Recife,
Fundação de Apoio ao Desenvolvimento da Universidade Federal de Pernambuco,2002,2.0,2,2,,OUTRO,['Oficina de Roteiro Cinematográfico'],2695085711637635,Leo Falcão,Falcão,"FALCÃO, Leo;FALCÃO, L.;FALCÃO, Leonardo Henrique Lago;FALCÃO, Leonardo H L",Recife,PE,"Doutor pelo Programa de Pós-Graduação em Design pela UFPE, especialista em Estudos Cinematográficos pela UNICAP e graduado em Comunicação Social pela UFPE. Tem uma carreira premiada como roteirista, diretor e produtor de cinema e TV, além de manter seu trabalho como músico. Nos últimos anos, tem estendido sua experiência para outros meios narrativos como literatura, teatro e áreas experimentais, tornando-se uma referência em projetos transmídia e narrativas contemporâneas. Foi vencedor do prêmio Young Creative Entrepreneur Award, promovido pelo British Council em 2012 ? e um dos artistas brasileiros selecionados para o Programa The Playable City, uma residência artística no Pervasive Media Studio em Bristol, Reino Unido, com o apoio do British Council e do Porto Digital. Seus interesses de pesquisa acadêmica e artística abrangem processos de criação e produção em formatos narrativos diversos: artes e narrativas contemporâneas, cinema (roteiro e direção), games, novas mídias, televisão, quadrinhos, música e publicidade. Foi por vários anos docente da UNICAP e atualmente é professor, pesquisador e designer de narrativas na CESAR School.",14-10-2022,Centro de Estudos e Sistemas Avançados do Recife,
Fundação de Apoio ao Desenvolvimento da Universidade Federal de Pernambuco,2002,6.0,6,6,,OUTRO,['Oficina de Roteiro Cinematográfico'],2695085711637635,Leo Falcão,Falcão,"FALCÃO, Leo;FALCÃO, L.;FALCÃO, Leonardo Henrique Lago;FALCÃO, Leonardo H L",Recife,PE,"Doutor pelo Programa de Pós-Graduação em Design pela UFPE, especialista em Estudos Cinematográficos pela UNICAP e graduado em Comunicação Social pela UFPE. Tem uma carreira premiada como roteirista, diretor e produtor de cinema e TV, além de manter seu trabalho como músico. Nos últimos anos, tem estendido sua experiência para outros meios narrativos como literatura, teatro e áreas experimentais, tornando-se uma referência em projetos transmídia e narrativas contemporâneas. Foi vencedor do prêmio Young Creative Entrepreneur Award, promovido pelo British Council em 2012 ? e um dos artistas brasileiros selecionados para o Programa The Playable City, uma residência artística no Pervasive Media Studio em Bristol, Reino Unido, com o apoio do British Council e do Porto Digital. Seus interesses de pesquisa acadêmica e artística abrangem processos de criação e produção em formatos narrativos diversos: artes e narrativas contemporâneas, cinema (roteiro e direção), games, novas mídias, televisão, quadrinhos, música e publicidade. Foi por vários anos docente da UNICAP e atualmente é professor, pesquisador e designer de narrativas na CESAR School.",14-10-2022,Centro de Estudos e Sistemas Avançados do Recife,
Italo Bianchi Consultor de Criação Publicitária,2002,2.0,2,2,,OUTRO,['Cinema Publicitário'],2695085711637635,Leo Falcão,Falcão,"FALCÃO, Leo;FALCÃO, L.;FALCÃO, Leonardo Henrique Lago;FALCÃO, Leonardo H L",Recife,PE,"Doutor pelo Programa de Pós-Graduação em Design pela UFPE, especialista em Estudos Cinematográficos pela UNICAP e graduado em Comunicação Social pela UFPE. Tem uma carreira premiada como roteirista, diretor e produtor de cinema e TV, além de manter seu trabalho como músico. Nos últimos anos, tem estendido sua experiência para outros meios narrativos como literatura, teatro e áreas experimentais, tornando-se uma referência em projetos transmídia e narrativas contemporâneas. Foi vencedor do prêmio Young Creative Entrepreneur Award, promovido pelo British Council em 2012 ? e um dos artistas brasileiros selecionados para o Programa The Playable City, uma residência artística no Pervasive Media Studio em Bristol, Reino Unido, com o apoio do British Council e do Porto Digital. Seus interesses de pesquisa acadêmica e artística abrangem processos de criação e produção em formatos narrativos diversos: artes e narrativas contemporâneas, cinema (roteiro e direção), games, novas mídias, televisão, quadrinhos, música e publicidade. Foi por vários anos docente da UNICAP e atualmente é professor, pesquisador e designer de narrativas na CESAR School.",14-10-2022,Centro de Estudos e Sistemas Avançados do Recife,
