PROJETO,DESCRICAO,SITUACAO,ANO_INICIO,ANO_FIM,ID,FULL_NAME,LAST_NAME,CITADO,CITY,STATE,RESUME,UPDATE,ADDRESS_ENTERP,ORCID
Programa Jornada Maker,"Este projeto visa a implementação do Programa de Criatividade, Empreendedorismo e Inovação com a utilização de Tecnologias Exponenciais de Fabricação Digital - Programa Jornada Maker, envolvendo crianças e jovens de 36 escolas da rede pública municipal de ensino da cidade do Recife, Pernambuco. O Programa Jornada Maker contribuirá, através de processos de cocriação, para a construção de um novo olhar e um novo modelo de articulação das vivências pedagógicas baseadas em desafios, experiências e projetos, articulando os programas de Tecnologia na Educação existentes na Secretaria de Educação da Prefeitura do Recife, bem como criando uma nova dinâmica de promoção do engajamento de estudantes, familiares, professores e comunidades em torno de uma agenda de construção de futuros desejáveis por todos.",EM_ANDAMENTO,2018,ATUAL,0113326674939174,Cristiana Leal de Lacerda Pires,Pires,"PIRES, C. L. L.",Recife,PE,"Doutoranda em Ciência da Computação (CIn-UFPE 2023), mestra em Design na linha Artefatos Digitais (UFPE 2019), graduada em Desenho Industrial com habilitação em Projeto do Produto (UFPE 2008). Atua há 15 anos na área de Desenvolvimento de Novos Produtos (NPD) e elaboração de projetos de P&amp;D de inovação tecnológica e industrial com foco na pesquisa aplicada, captação de recursos e propriedade intelectual. Pesquisadora de abordagens de design colaborativo e transdisciplinar em hackathons, com ênfase em metathons (hackathons do metaverso) e pensamento ciborgue, é também Analista Educacional Sênior no CESAR - Centro de Estudos e Sistemas Avançados do Recife, atuando no desenvolvimento de produtos e soluções educacionais para instituições de ensino, centros de pesquisa, núcleos de inovação e iniciativa privada. Ainda, é sócia e conselheira do Fab Lab Recife, responsável pela cooperação internacional e gestão do conhecimento em PD&amp;I com uso de tecnologias de fabricação digital na interface Academia-Mercado, além de de community connector da Singularity University no Recife chapter, e docente visitante da especialização em Tecnologias do Design na UNICAP ICAM-Tech International School. Em 2018 e 2019 foi finalista do Creative Learning Challenge Brazil, promovido pelo MIT Media Lab com o apoio da Fundação Lemann.",28-09-2022,,https://orcid.org/0000-0003-4581-6225
Programa Empreendedorismo Maker,"O Programa Empreendedorismo Maker consiste em um programa de capacitação de estudantes da rede Estadual (ETE) e Federal (IFPE) de Belo Jardim, em Tecnologia, Design e Negócios por meio de 16 encontros teórico-práticos no laboratório Território do Fazer, localizado na Sede do Instituto Conceição Moura em Belo Jardim - PE. Assim, serão capacitados 20 Agentes de Inovação no Letramento Tecnológico Básico em Fabricação Digital, no Desenvolvimento de Produtos de Baixa Complexidade, e na Elaboração de Plano de Negócios Simplificado, criando produtos reais com potencial de inserção no mercado local da cidade de Belo Jardim.",EM_ANDAMENTO,2019,ATUAL,0113326674939174,Cristiana Leal de Lacerda Pires,Pires,"PIRES, C. L. L.",Recife,PE,"Doutoranda em Ciência da Computação (CIn-UFPE 2023), mestra em Design na linha Artefatos Digitais (UFPE 2019), graduada em Desenho Industrial com habilitação em Projeto do Produto (UFPE 2008). Atua há 15 anos na área de Desenvolvimento de Novos Produtos (NPD) e elaboração de projetos de P&amp;D de inovação tecnológica e industrial com foco na pesquisa aplicada, captação de recursos e propriedade intelectual. Pesquisadora de abordagens de design colaborativo e transdisciplinar em hackathons, com ênfase em metathons (hackathons do metaverso) e pensamento ciborgue, é também Analista Educacional Sênior no CESAR - Centro de Estudos e Sistemas Avançados do Recife, atuando no desenvolvimento de produtos e soluções educacionais para instituições de ensino, centros de pesquisa, núcleos de inovação e iniciativa privada. Ainda, é sócia e conselheira do Fab Lab Recife, responsável pela cooperação internacional e gestão do conhecimento em PD&amp;I com uso de tecnologias de fabricação digital na interface Academia-Mercado, além de de community connector da Singularity University no Recife chapter, e docente visitante da especialização em Tecnologias do Design na UNICAP ICAM-Tech International School. Em 2018 e 2019 foi finalista do Creative Learning Challenge Brazil, promovido pelo MIT Media Lab com o apoio da Fundação Lemann.",28-09-2022,,https://orcid.org/0000-0003-4581-6225
Diversidade e Inclusão,"Fruto da disciplina Análise e Comunicação da Pesquisa (ACP), 2º período da graduação em Design, este projeto teve como objetivo realizar o monitoramento do sentimento/percepção/cohecimento das pessoas estudantes da Cesar School (cursos de design e ciência da computação) sobre Diversidade e Inclusão. Foram realizadas  entrevista, formulários, etnografia e netnografia para a geração de relatório, bem como proposição de possíveis ações para criar um ambiente mais diverso e acolhedor no ambiente acadêmico.",CONCLUIDO,2022,2022,0342261677880699,Tatalina Cristina Silva de Oliveira,Oliveira,"OLIVEIRA, T. C. S.",Recife,PE,"Inquieta, criativa e comunicativa. Aficionada por esportes, adrenalina e arte. Observadora nata de pessoas e suas formas de consumo, o que me leva à paixão pelos estudos de tendência de comportamento (trendhunter). Designer de formação, com uma trajetória profissional que me levou à moda e antropologia, docência, palestras e consultorias. Experiente em gerir projetos, grupos, elaborar parcerias entre instituições e desenvolver pesquisas que envolvam diversidade e inclusão.  Interesse por inovação, moda e sua relação com gênero, negritude e questões socioculturais,bem como com memória gráfica, história da arte e do design, estudos de consumo, com foco em cultura material.&amp;#10;&amp;#10;Doutorado  (2018) e Mestrado (2010) em Design pelo Programa de pós-graduação em Design da UFPE (2018).Especialização (2011) em Antropologia Social e Cultural pelo Instituto de Ciências Sociais da Universidade de Lisboa - Portugal  (ICS-UL). Graduada pelo Centro Federal de Educação Tecnológica de Pernambuco (2006) no Curso Superior de Tecnologia em Design Gráfico.",29-11-2022,,
Manual de Técnicas de Ideação para Designers (ou não),"Manual desenvolvido por pessoas estudantes da disciplina de Técnicas de Ideação (turma 2020.1), da graduação em design, no qual são testadas e apresentadas técnicas de ideação, adaptadas para formado presencial ou remoto.",EM_ANDAMENTO,2022,ATUAL,0342261677880699,Tatalina Cristina Silva de Oliveira,Oliveira,"OLIVEIRA, T. C. S.",Recife,PE,"Inquieta, criativa e comunicativa. Aficionada por esportes, adrenalina e arte. Observadora nata de pessoas e suas formas de consumo, o que me leva à paixão pelos estudos de tendência de comportamento (trendhunter). Designer de formação, com uma trajetória profissional que me levou à moda e antropologia, docência, palestras e consultorias. Experiente em gerir projetos, grupos, elaborar parcerias entre instituições e desenvolver pesquisas que envolvam diversidade e inclusão.  Interesse por inovação, moda e sua relação com gênero, negritude e questões socioculturais,bem como com memória gráfica, história da arte e do design, estudos de consumo, com foco em cultura material.&amp;#10;&amp;#10;Doutorado  (2018) e Mestrado (2010) em Design pelo Programa de pós-graduação em Design da UFPE (2018).Especialização (2011) em Antropologia Social e Cultural pelo Instituto de Ciências Sociais da Universidade de Lisboa - Portugal  (ICS-UL). Graduada pelo Centro Federal de Educação Tecnológica de Pernambuco (2006) no Curso Superior de Tecnologia em Design Gráfico.",29-11-2022,,
Jornada de Novos Negócios,"Construção da base, guia para 4 semestres do programa Jonada de Novos Negócios, foco em empreendedorismo e inovação.",EM_ANDAMENTO,2021,ATUAL,5943304308541304,Georgina Venancio de Queiroz,Queiroz,"Venancio, Georgina;Queiroz, Georgina V;Queiroz, GV;Venancio, Georgina Queiroz;Queiroz, Georgina",Recife,PE,"Mestra em Gestão Empresarial pela UniFBV&amp;#10;Especialista em Marketing pela FGV e em Planejamento e Gestão Organizacional pela FCAP&amp;#10;Graduação em Administração de Empresas pela Universidade Católica de Pernambuco.&amp;#10;&amp;#10;Titular de disciplinas na CESAR School (www.cesar.school)&amp;#10;Integrante do grupo de professores convidados de pós graduação do Centro de Desenvolvimento Pessoal e Empresarial - CEDEPE (www.cedepe.com.br)&amp;#10;Atua como professora convidada e coordenadora do MBA em Marketing Digital na UniSãoMiguel (www.unisaomiguel.edu.br)&amp;#10;&amp;#10;Tem experiências na área de Gestão, com ênfase em Marketing e Comunicação, atuando principalmente nos seguintes temas: marketing, marketing de relacionamento, clientes, consumo, projetos, comunicação, fidelização e planejamento estratégico.",19-09-2022,,
InternAbroad: University of South-Eastern Norway - Universidade Federal Rural de Pernambuco,Projeto de intercâmbio entre a Universidade Federal Rural de Pernambuco e a University of South-Eastern Norway.,EM_ANDAMENTO,2020,ATUAL,6190254569597745,Rafael Ferreira Leite de Mello,Mello,"Rafael Ferreira;Ferreira, Rafael;Rafael Mello;RAFAEL MELLO;MELLO, RAFAEL FE;FERREIRA'MELLO, RAFAEL;MELLO, RAFAEL FERREIRA;Ferreira Mello, Rafael;Rafael Ferreira Mello;MELLO, RAFAEL FERREIRA LEITE DE;MELLO, RAFAEL;FERREIRAMELLO, RAFAEL;MELLO, RAFAEL F. L.",Arapiraca,AL,"Rafael Ferreira Mello é doutor em ciência da computação com interesses de pesquisa que abrangem processamento de linguagem natural, learning analytics e tecnologia educacional. Ele é professor na Universidade Federal Rural de Pernambuco e no Cesar School, no Brasil, onde é um dos coordenadores do Laboratório de Inteligência Artificial (https://aiboxlab.org/), que desenvolve várias iniciativas relacionadas a learning analytics (LA). Dr. Mello realizou pós-doutorado na Escola de Informática da Universidade de Edimburgo em 2018, onde continua a ter colaborações. Ele trabalha em vários projetos de pesquisa multinacionais, que envolvem parceiros acadêmicos e empresas na Europa, Austrália, Estados Unidos e América Latina. A experiência anterior do Dr. Mello também inclui um projeto de pesquisa financiado pela Hewlett-Packard, onde atuou como líder técnico. Um tema-chave de sua pesquisa recente tem sido o uso do processamento de linguagem natural aplicados como educação e temas mais focados em análise de textos como sumarização e classificação.",08-01-2023,Universidade Federal Rural de Pernambuco,https://orcid.org/0000-0003-3548-9670
Curso de Especialização em Inteligência Computacional Aplicada,"O Curso de Especialização em Inteligência Computacional Aplicada é um projeto de formação aprovado no Edital PITEC 13/2019 da FACEPE que tem o objetivo de formar profissionais na área de Inteligência Computacional. Através de uma metodologia de ensino baseada em problemas (PBL), os alunos interagem com a teoria e aplicam o conhecimento em projetos práticos do mundo real.",CONCLUIDO,2020,2021,6190254569597745,Rafael Ferreira Leite de Mello,Mello,"Rafael Ferreira;Ferreira, Rafael;Rafael Mello;RAFAEL MELLO;MELLO, RAFAEL FE;FERREIRA'MELLO, RAFAEL;MELLO, RAFAEL FERREIRA;Ferreira Mello, Rafael;Rafael Ferreira Mello;MELLO, RAFAEL FERREIRA LEITE DE;MELLO, RAFAEL;FERREIRAMELLO, RAFAEL;MELLO, RAFAEL F. L.",Arapiraca,AL,"Rafael Ferreira Mello é doutor em ciência da computação com interesses de pesquisa que abrangem processamento de linguagem natural, learning analytics e tecnologia educacional. Ele é professor na Universidade Federal Rural de Pernambuco e no Cesar School, no Brasil, onde é um dos coordenadores do Laboratório de Inteligência Artificial (https://aiboxlab.org/), que desenvolve várias iniciativas relacionadas a learning analytics (LA). Dr. Mello realizou pós-doutorado na Escola de Informática da Universidade de Edimburgo em 2018, onde continua a ter colaborações. Ele trabalha em vários projetos de pesquisa multinacionais, que envolvem parceiros acadêmicos e empresas na Europa, Austrália, Estados Unidos e América Latina. A experiência anterior do Dr. Mello também inclui um projeto de pesquisa financiado pela Hewlett-Packard, onde atuou como líder técnico. Um tema-chave de sua pesquisa recente tem sido o uso do processamento de linguagem natural aplicados como educação e temas mais focados em análise de textos como sumarização e classificação.",08-01-2023,Universidade Federal Rural de Pernambuco,https://orcid.org/0000-0003-3548-9670
